<?xml version="1.0" encoding="UTF-8"?>
<gems xmlns:xsi="http://www.w3.org/2001/XMLSchema-instance"
	xsi:noNamespaceSchemaLocation="gems.xsd">
	<precious_gem gem_id="a1">
		<name>Diamond</name>
		<origin>USA</origin>
		<visual_parameters faces="57">
			<color>Colorless</color>
			<clarity>98%</clarity>
		</visual_parameters>
		<weight measure="ct.">1.01</weight>
		<price currency="USD">4000000</price>
		<preciousness>Precious</preciousness>
	</precious_gem>
	<fake_gem gem_id="b1">
		<name>Synthetic diamond</name>
		<origin>China</origin>
		<visual_parameters faces="57">
			<color>Colorless</color>
			<clarity>90%</clarity>
		</visual_parameters>
		<weight measure="ct.">1.01</weight>
		<price currency="USD">200</price>
		<method>Crystallization</method>
		<creation_date>2017-06-08</creation_date>
	</fake_gem>
</gems>